I will create custom desktop application,
I will do c cpp java js python programming programs and projects,
I will code c language cpp python java programming tasks and projects,Level 1
I will fix python code  teach  web scrapping  make gui in pyqt tkinter kivy kivymd,Level 1
I will convert tradingview pinescript alerts to interactive broker order,
I will do genetic algorithm  pso optimizations in 24 hours,Level 1
I will coding python data science machine learning java programming script bot project,
I will be your full stack python django developer,Level 2
I will debug and fix python  django  flask  pandas  openai  sqlalchemy code,Level 2
I will create web scraper  web crawler and bots to automate task,Level 2
I will write python script for blender,Level 1
I will do customisation and creation of new module for odoo,Level 2
I will setup odoo v8 to v17 on vps and customize,Level 2
I will create bots and web crawlers in python,Level 1
I will create python web and desktop based applications,Level 2
I will develop your own script or program to make your life easier,Level 2
I will install  configure and make custom odoo modules,Level 1
I will develop dynamic web app or rest API using python flask,Level 2
I will do web automation in 3 hours using python selenium,Level 1
I will be your expert python  django  fastapi web app full stack developer,
I will do python programming on idle  spyder and visual studio code,
I will do zapier integration and zapier automation,Level 2
I will install  configure  develop  or customise modules in odoo,
I will develop web application  web based software and mobile app,Level 2
I will write  edit  and review splunk app and addon,